{
  "verify_result_version": "v2-draft",
  "result": "FAIL",
  "reason_code": "HASH_MISMATCH",
  "canonicalization_profile": "digiemu-canonical-json-v1",
  "hash_algorithm": "sha256",
  "reconstruction_profile": "digiemu-reconstruct-v1",
  "verifier_version": "0.0.0-draft",
  "snapshot_hash_expected": "sha256:1111111111111111111111111111111111111111111111111111111111111111",
  "snapshot_hash_actual": "sha256:2222222222222222222222222222222222222222222222222222222222222222",
  "failure_path": "/input_state/value"
}
